   Compiling config-tests v0.1.0 (/Users/THarpool/Code/personel/spin-todo-api/tests)
    Finished `release` profile [optimized] target(s) in 1.74s

running 152 tests

thread '<unnamed>' panicked at src/docket_tests_v2.rs:627:5:
assertion failed: status == 201 || status == 409
note: run with `RUST_BACKTRACE=1` environment variable to display a backtrace

thread '<unnamed>' panicked at src/order_tests_v2.rs:239:5:
Should return at least 2 orders
note: run with `RUST_BACKTRACE=1` environment variable to display a backtrace

thread '<unnamed>' panicked at src/order_tests_v2.rs:120:5:
Create should return 201 (created) or 409 (exists), got 400: {"error":"Invalid data format","status":400,"details":"premature end of input at line 1 column 419"}
note: run with `RUST_BACKTRACE=1` environment variable to display a backtrace

thread '<unnamed>' panicked at src/docket_tests_v2.rs:192:5:
assertion `left == right` failed: Should return 200 for case docket
  left: 400
 right: 200
note: run with `RUST_BACKTRACE=1` environment variable to display a backtrace

thread '<unnamed>' panicked at src/header_routing_tests.rs:148:5:
Should indicate missing district
note: run with `RUST_BACKTRACE=1` environment variable to display a backtrace

thread '<unnamed>' panicked at src/opinion_tests_v2.rs:362:5:
assertion `left == right` failed: Publish should return 200
  left: 400
 right: 200
note: run with `RUST_BACKTRACE=1` environment variable to display a backtrace

thread '<unnamed>' panicked at src/opinion_tests_v2.rs:188:5:
Error should mention missing author_judge_id field
note: run with `RUST_BACKTRACE=1` environment variable to display a backtrace

thread '<unnamed>' panicked at src/opinion_tests_v2.rs:303:5:
Should return judge's opinions
note: run with `RUST_BACKTRACE=1` environment variable to display a backtrace

thread '<unnamed>' panicked at src/sentencing_tests_v2.rs:408:5:
assertion `left == right` failed: Update should return 200
  left: 405
 right: 200
note: run with `RUST_BACKTRACE=1` environment variable to display a backtrace

thread '<unnamed>' panicked at src/order_tests_v2.rs:155:5:
Error should mention missing case_id field
note: run with `RUST_BACKTRACE=1` environment variable to display a backtrace

thread '<unnamed>' panicked at src/attorney_tests_v2.rs:454:5:
Error should mention invalid email
note: run with `RUST_BACKTRACE=1` environment variable to display a backtrace

thread '<unnamed>' panicked at src/sentencing_tests_v2.rs:322:5:
assertion `left == right` failed: Should return 200 for existing guidelines
  left: 404
 right: 200
note: run with `RUST_BACKTRACE=1` environment variable to display a backtrace

thread '<unnamed>' panicked at src/sentencing_tests_v2.rs:350:5:
assertion `left == right` failed: Record departure should return 200
  left: 400
 right: 200
note: run with `RUST_BACKTRACE=1` environment variable to display a backtrace
test test-record-departure                        ... [0m[31mFAILED[0m
test test-docket-multi-tenant-isolation           ... [0m[31mFAILED[0m
test test-publish-opinion                         ... [0m[31mFAILED[0m
test test-create-order-missing-case-id            ... [0m[31mFAILED[0m
test test-get-opinions-by-judge                   ... [0m[31mFAILED[0m
test test-get-case-docket                         ... [0m[31mFAILED[0m
test test-create-opinion-missing-author           ... [0m[31mFAILED[0m
test test-create-attorney-invalid-email           ... [0m[31mFAILED[0m
test test-update-sentencing                       ... [0m[31mFAILED[0m
test test-config-requires-district-header         ... [0m[31mFAILED[0m
test test-create-order-success                    ... [0m[31mFAILED[0m
test test-health-check                            ... [0m[32mok[0m
test test-list-orders                             ... [0m[31mFAILED[0m
test test-get-guidelines-by-id                    ... [0m[31mFAILED[0m

thread '<unnamed>' panicked at src/docket_tests_v2.rs:588:5:
assertion `left == right` failed: Should return 200 for statistics
  left: 400
 right: 200
note: run with `RUST_BACKTRACE=1` environment variable to display a backtrace

thread '<unnamed>' panicked at src/order_tests_v2.rs:550:5:
Should return expiring orders
note: run with `RUST_BACKTRACE=1` environment variable to display a backtrace

thread '<unnamed>' panicked at src/deadline_tests_v2.rs:368:5:
Extension request should return 201 or 200, got 400: {"error":"Bad Request","status":400,"details":"Invalid deadline ID"}
note: run with `RUST_BACKTRACE=1` environment variable to display a backtrace
test test-valid-district-header-district9         ... [0m[32mok[0m
test test-get-filing-statistics                   ... [0m[31mFAILED[0m
test test-get-expiring-orders                     ... [0m[31mFAILED[0m
test test-sentencing-multi-tenant-isolation       ... [0m[32mok[0m
test test-request-extension                       ... [0m[31mFAILED[0m
test test-create-judge-with-store                 ... [0m[32mok[0m

thread '<unnamed>' panicked at src/order_tests_v2.rs:317:5:
assertion `left == right` failed: Update should return 200
  left: 404
 right: 200
note: run with `RUST_BACKTRACE=1` environment variable to display a backtrace

thread '<unnamed>' panicked at src/opinion_tests_v2.rs:229:5:
assertion `left == right` failed: Should return 400 for invalid opinion
  left: 404
 right: 400
note: run with `RUST_BACKTRACE=1` environment variable to display a backtrace

thread '<unnamed>' panicked at src/docket_tests_v2.rs:433:5:
assertion `left == right` failed: Should return 200 for speedy trial status
  left: 400
 right: 200
note: run with `RUST_BACKTRACE=1` environment variable to display a backtrace
test test-create-judge-missing-title              ... [0m[32mok[0m

thread '<unnamed>' panicked at src/deadline_tests_v2.rs:206:5:
assertion `left == right` failed: Should return 200 for existing deadline
  left: 400
 right: 200
note: run with `RUST_BACKTRACE=1` environment variable to display a backtrace
thread '<unnamed>' panicked at crates/spin-test-virt/src/wasi/http.rs:370:9:
not yet implemented
note: run with `RUST_BACKTRACE=1` environment variable to display a backtrace
